{
  "schema": "md2hwp.ir",
  "ir_version": "0.3",
  "metadata": {},
  "blocks": [
    {
      "type": "heading",
      "level": 2,
      "inlines": [
        {
          "type": "text",
          "value": "그림과"
        },
        {
          "type": "space"
        },
        {
          "type": "text",
          "value": "박스"
        },
        {
          "type": "space"
        },
        {
          "type": "text",
          "value": "출처"
        }
      ]
    },
    {
      "type": "figure",
      "image": {
        "path": "../assets/sample-urban-context.png",
        "alt": [
          {
            "type": "text",
            "value": "도시"
          },
          {
            "type": "space"
          },
          {
            "type": "strong",
            "inlines": [
              {
                "type": "text",
                "value": "맥락"
              }
            ]
          }
        ],
        "title": "도시 맥락 이미지"
      },
      "caption": [
        {
          "type": "text",
          "value": "도시"
        },
        {
          "type": "space"
        },
        {
          "type": "strong",
          "inlines": [
            {
              "type": "text",
              "value": "맥락"
            }
          ]
        }
      ],
      "source": [
        {
          "type": "strong",
          "inlines": [
            {
              "type": "text",
              "value": "작성자"
            }
          ]
        },
        {
          "type": "space"
        },
        {
          "type": "text",
          "value": "·"
        },
        {
          "type": "space"
        },
        {
          "type": "text",
          "value": "https://example.com"
        }
      ]
    },
    {
      "type": "verbatim_block",
      "lines": [
        "박스 첫째 줄",
        "",
        "빈 줄 다음 줄"
      ],
      "source": [
        {
          "type": "emph",
          "inlines": [
            {
              "type": "text",
              "value": "현장"
            },
            {
              "type": "space"
            },
            {
              "type": "text",
              "value": "조사"
            }
          ]
        },
        {
          "type": "space"
        },
        {
          "type": "text",
          "value": "2026"
        }
      ]
    },
    {
      "type": "paragraph",
      "inlines": [
        {
          "type": "text",
          "value": "이"
        },
        {
          "type": "space"
        },
        {
          "type": "text",
          "value": "문단은"
        },
        {
          "type": "space"
        },
        {
          "type": "text",
          "value": "박스"
        },
        {
          "type": "space"
        },
        {
          "type": "text",
          "value": "출처와"
        },
        {
          "type": "space"
        },
        {
          "type": "text",
          "value": "별도로"
        },
        {
          "type": "space"
        },
        {
          "type": "text",
          "value": "유지합니다."
        }
      ]
    },
    {
      "type": "paragraph",
      "inlines": [
        {
          "type": "text",
          "value": "출처:"
        },
        {
          "type": "space"
        },
        {
          "type": "text",
          "value": "일반"
        },
        {
          "type": "space"
        },
        {
          "type": "text",
          "value": "본문의"
        },
        {
          "type": "space"
        },
        {
          "type": "text",
          "value": "문구도"
        },
        {
          "type": "space"
        },
        {
          "type": "text",
          "value": "그대로"
        },
        {
          "type": "space"
        },
        {
          "type": "text",
          "value": "유지합니다."
        }
      ]
    },
    {
      "type": "verbatim_block",
      "lines": [
        "출처 없는 박스"
      ]
    },
    {
      "type": "figure",
      "image": {
        "path": "../assets/sample-urban-context.png",
        "alt": [
          {
            "type": "text",
            "value": "두"
          },
          {
            "type": "space"
          },
          {
            "type": "text",
            "value": "번째"
          },
          {
            "type": "space"
          },
          {
            "type": "text",
            "value": "그림"
          }
        ],
        "title": null
      },
      "caption": [
        {
          "type": "text",
          "value": "두"
        },
        {
          "type": "space"
        },
        {
          "type": "text",
          "value": "번째"
        },
        {
          "type": "space"
        },
        {
          "type": "text",
          "value": "그림"
        }
      ],
      "source": null
    }
  ]
}
